Titulo,Descricao,Imagem,Quantidade,Preço,Avaliação,Status
Lab Girl,,,0,40.85,1,In stock
Keep Me Posted,,,0,20.46,4,In stock
It Didn't Start with You: How Inherited Family Trauma Shapes Who We Are and How to End the Cycle,,,0,56.27,3,In stock
Grey (Fifty Shades #4),,,0,48.49,4,In stock
"Exit, Pursued by a Bear",,,0,51.34,4,In stock
Daredevils,,,0,16.34,3,In stock
Cravings: Recipes for What You Want to Eat,,,0,20.5,3,In stock
Born for This: How to Find the Work You Were Meant to Do,,,0,21.59,5,In stock
Arena,,,0,21.36,4,In stock
Adultery,,,0,20.88,5,In stock
A Mother's Reckoning: Living in the Aftermath of Tragedy,,,0,19.53,3,In stock
A Gentleman's Position (Society of Gentlemen #3),,,0,14.75,5,In stock
11/22/63,,,0,48.48,3,In stock
"10% Happier: How I Tamed the Voice in My Head, Reduced Stress Without Losing My Edge, and Found Self-Help That Actually Works",,,0,24.57,2,In stock
10-Day Green Smoothie Cleanse: Lose Up to 15 Pounds in 10 Days!,,,0,49.71,5,In stock
Without Shame,,,0,48.27,5,In stock
Watchmen,,,0,58.05,4,In stock
Unlimited Intuition Now,,,0,58.87,4,In stock
Underlying Notes,,,0,11.82,2,In stock
The Shack,,,0,28.03,1,In stock
The New Brand You: Your New Image Makes the Sale for You,,,0,44.05,5,In stock
"The Moosewood Cookbook: Recipes from Moosewood Restaurant, Ithaca, New York",,,0,12.34,4,In stock
The Flowers Lied,,,0,16.68,2,In stock
"The Fabric of the Cosmos: Space, Time, and the Texture of Reality",,,0,55.91,1,In stock
The Book of Mormon,,,0,24.57,3,In stock
The Art and Science of Low Carbohydrate Living,,,0,52.98,5,In stock
The Alien Club,,,0,54.4,1,In stock
Suzie Snowflake: One beautiful flake (a self-esteem story),,,0,54.81,5,In stock
Nap-a-Roo,,,0,25.08,1,In stock
"NaNo What Now? Finding your editing process, revising your NaNoWriMo book and building a writing career through publishing and beyond",,,0,10.41,4,In stock
Modern Day Fables,,,0,47.44,2,In stock
If I Gave You God's Phone Number....: Searching for Spirituality in America,,,0,20.91,1,In stock
"Fruits Basket, Vol. 9 (Fruits Basket #9)",,,0,33.95,4,In stock
Dress Your Family in Corduroy and Denim,,,0,43.68,3,In stock
Don't Forget Steven,,,0,33.23,1,In stock
Chernobyl 01:23:40: The Incredible True Story of the World's Worst Nuclear Disaster,,,0,35.92,2,In stock
Art and Fear: Observations on the Perils (and Rewards) of Artmaking,,,0,48.63,4,In stock
A Shard of Ice (The Black Symphony Saga #1),,,0,56.63,3,In stock
A Hero's Curse (The Unseen Chronicles #1),,,0,50.49,3,In stock
23 Degrees South: A Tropical Tale of Changing Whether...,,,0,35.79,2,In stock
"Zero to One: Notes on Startups, or How to Build the Future",,,0,34.06,3,In stock
Why Not Me?,,,0,17.76,1,In stock
When Breath Becomes Air,,,0,39.36,2,In stock
Vagabonding: An Uncommon Guide to the Art of Long-Term World Travel,,,0,36.94,2,In stock
The Unlikely Pilgrimage of Harold Fry (Harold Fry #1),,,0,43.62,5,In stock
The New Drawing on the Right Side of the Brain,,,0,43.02,3,In stock
"The Midnight Assassin: Panic, Scandal, and the Hunt for America's First Serial Killer",,,0,28.45,4,In stock
The Martian (The Martian #1),,,0,41.39,2,In stock
The High Mountains of Portugal,,,0,51.15,1,In stock
The Grownup,,,0,35.88,1,In stock
The E-Myth Revisited: Why Most Small Businesses Don't Work and What to Do About It,,,0,36.91,1,In stock
South of Sunshine,,,0,28.93,1,In stock
Smarter Faster Better: The Secrets of Being Productive in Life and Business,,,0,38.89,5,In stock
Silence in the Dark (Logan Point #4),,,0,58.33,3,In stock
Shadows of the Past (Logan Point #1),,,0,39.67,5,In stock
Roller Girl,,,0,14.1,5,In stock
Rising Strong,,,0,21.82,3,In stock
Proofs of God: Classical Arguments from Tertullian to Barth,,,0,54.21,1,In stock
Please Kill Me: The Uncensored Oral History of Punk,,,0,31.19,4,In stock
Out of Print: City Lights Spotlight No. 14,,,0,53.64,5,In stock
My Life Next Door (My Life Next Door ),,,0,36.39,5,In stock
Miller's Valley,,,0,58.54,2,In stock
Man's Search for Meaning,,,0,29.48,3,In stock
"Love That Boy: What Two Presidents, Eight Road Trips, and My Son Taught Me About a Parent's Expectations",,,0,25.06,2,In stock
Living Forward: A Proven Plan to Stop Drifting and Get the Life You Want,,,0,12.55,3,In stock
Les Fleurs du Mal,,,0,29.04,5,In stock
Left Behind (Left Behind #1),,,0,40.72,2,In stock
Kill 'Em and Leave: Searching for James Brown and the American Soul,,,0,45.05,5,In stock
Kierkegaard: A Christian Missionary to Christians,,,0,47.13,1,In stock
John Vassos: Industrial Design for Modern Life,,,0,20.22,4,In stock
I'll Give You the Sun,,,0,56.48,1,In stock
I Will Find You,,,0,44.21,1,In stock
Hystopia: A Novel,,,0,21.96,4,In stock
Howl and Other Poems,,,0,40.45,2,In stock
History of Beauty,,,0,10.29,4,In stock
Heaven is for Real: A Little Boy's Astounding Story of His Trip to Heaven and Back,,,0,52.86,2,In stock
Future Shock (Future Shock #1),,,0,55.65,5,In stock
Ender's Game (The Ender Quintet #1),,,0,43.64,1,In stock
Diary of a Citizen Scientist: Chasing Tiger Beetles and Other New Ways of Engaging the World,,,0,28.41,1,In stock
Death by Leisure: A Cautionary Tale,,,0,37.51,4,In stock
Brilliant Beacons: A History of the American Lighthouse,,,0,11.45,3,In stock
Brazen: The Courage to Find the You That's Been Hiding,,,0,19.22,2,In stock
Between the World and Me,,,0,56.91,4,In stock
Being Mortal: Medicine and What Matters in the End,,,0,55.06,4,In stock
"A Murder Over a Girl: Justice, Gender, Junior High",,,0,13.2,3,In stock
32 Yolks,,,0,53.63,2,In stock
"""Most Blessed of the Patriarchs"": Thomas Jefferson and the Empire of the Imagination",,,0,44.48,5,In stock
You Are a Badass: How to Stop Doubting Your Greatness and Start Living an Awesome Life,,,0,12.08,3,In stock
Wildlife of New York: A Five-Borough Coloring Book,,,0,22.14,2,In stock
What Happened on Beale Street (Secrets of the South Mysteries #2),,,0,25.37,5,In stock
Unreasonable Hope: Finding Faith in the God Who Brings Purpose to Your Pain,,,0,46.33,2,In stock
Under the Tuscan Sun,,,0,37.33,3,In stock
Toddlers Are A**holes: It's Not Your Fault,,,0,25.55,1,In stock
The Year of Living Biblically: One Man's Humble Quest to Follow the Bible as Literally as Possible,,,0,34.72,1,In stock
The Whale,,,0,35.96,4,In stock
The Story of Art,,,0,41.14,4,In stock
The Origin of Species,,,0,10.01,4,In stock
The Great Gatsby,,,0,36.05,4,In stock
The Good Girl,,,0,49.03,3,In stock
The Glass Castle,,,0,16.24,1,In stock
The Faith of Christopher Hitchens: The Restless Soul of the World's Most Notorious Atheist,,,0,39.55,1,In stock
The Drowning Girls,,,0,35.67,3,In stock
The Constant Princess (The Tudor Court #1),,,0,16.62,3,In stock
The Bourne Identity (Jason Bourne #1),,,0,42.78,4,In stock
The Bachelor Girl's Guide to Murder (Herringford and Watts Mysteries #1),,,0,52.3,5,In stock
The Art Book,,,0,32.34,2,In stock
The 7 Habits of Highly Effective People: Powerful Lessons in Personal Change,,,0,33.17,4,In stock
Team of Rivals: The Political Genius of Abraham Lincoln,,,0,20.12,5,In stock
Steal Like an Artist: 10 Things Nobody Told You About Being Creative,,,0,20.9,2,In stock
"Sit, Stay, Love",,,0,20.9,3,In stock
Sister Dear,,,0,40.2,4,In stock
"Shrunken Treasures: Literary Classics, Short, Sweet, and Silly",,,0,52.87,3,In stock
"Rich Dad, Poor Dad",,,0,51.74,1,In stock
Raymie Nightingale,,,0,34.41,2,In stock
Playing from the Heart,,,0,32.38,1,In stock
Nightstruck: A Novel,,,0,50.35,4,In stock
"Naturally Lean: 125 Nourishing Gluten-Free, Plant-Based Recipes--All Under 300 Calories",,,0,11.38,5,In stock
Meternity,,,0,43.58,3,In stock
Memoirs of a Geisha,,,0,49.67,3,In stock
Like Never Before (Walker Family #2),,,0,28.77,2,In stock
Life of Pi,,,0,13.22,4,In stock
Leave This Song Behind: Teen Poetry at Its Best,,,0,51.17,5,In stock
King's Folly (The Kinsman Chronicles #1),,,0,39.61,5,In stock
John Adams,,,0,57.43,4,In stock
How to Cook Everything Vegetarian: Simple Meatless Recipes for Great Food (How to Cook Everything),,,0,46.01,4,In stock
How to Be a Domestic Goddess: Baking and the Art of Comfort Cooking,,,0,28.25,2,In stock
Good in Bed (Cannie Shapiro #1),,,0,37.05,5,In stock
"Fruits Basket, Vol. 7 (Fruits Basket #7)",,,0,19.57,1,In stock
For the Love: Fighting for Grace in a World of Impossible Standards,,,0,45.13,3,In stock
Finding God in the Ruins: How God Redeems Pain,,,0,46.64,2,In stock
Every Heart a Doorway (Every Heart A Doorway #1),,,0,12.16,5,In stock
Delivering the Truth (Quaker Midwife Mystery #1),,,0,20.89,4,In stock
Counted With the Stars (Out from Egypt #1),,,0,17.97,5,In stock
"Chronicles, Vol. 1",,,0,52.6,2,In stock
Blue Like Jazz: Nonreligious Thoughts on Christian Spirituality,,,0,25.77,1,In stock
Benjamin Franklin: An American Life,,,0,48.19,3,In stock
"At The Existentialist CafÃ©: Freedom, Being, and apricot cocktails with: Jean-Paul Sartre, Simone de Beauvoir, Albert Camus, Martin Heidegger, Edmund Husserl, Karl Jaspers, Maurice Merleau-Ponty and others",,,0,29.93,5,In stock
A Summer In Europe,,,0,44.34,2,In stock
A Short History of Nearly Everything,,,0,52.4,5,In stock
A Gathering of Shadows (Shades of Magic #2),,,0,44.81,4,In stock
The Sound Of Love,,,0,57.84,5,In stock
The Rise and Fall of the Third Reich: A History of Nazi Germany,,,0,39.67,2,In stock
The Perks of Being a Wallflower,,,0,55.02,3,In stock
The Mysterious Affair at Styles (Hercule Poirot #1),,,0,24.8,4,In stock
The Man Who Mistook His Wife for a Hat and Other Clinical Tales,,,0,59.45,4,In stock
The Makings of a Fatherless Child,,,0,31.58,2,In stock
The Joy of Cooking,,,0,43.27,4,In stock
The Invention of Wings,,,0,37.34,1,In stock
The Hobbit (Middle-Earth Universe),,,0,17.8,5,In stock
The Great Railway Bazaar,,,0,30.54,1,In stock
The Golden Compass (His Dark Materials #1),,,0,18.77,1,In stock
The God Delusion,,,0,46.85,3,In stock
The Girl You Left Behind (The Girl You Left Behind #1),,,0,15.79,1,In stock
The Fellowship of the Ring (The Lord of the Rings #1),,,0,10.27,2,In stock
The Collected Poems of W.B. Yeats (The Collected Works of W.B. Yeats #1),,,0,15.42,5,In stock
The Barefoot Contessa Cookbook,,,0,59.92,5,In stock
Tell the Wolves I'm Home,,,0,50.96,2,In stock
Ship Leaves Harbor: Essays on Travel by a Recovering Journeyman,,,0,30.6,3,In stock
Pride and Prejudice,,,0,19.27,4,In stock
Musicophilia: Tales of Music and the Brain,,,0,46.58,1,In stock
Mere Christianity,,,0,48.51,3,In stock
Me Before You (Me Before You #1),,,0,19.02,1,In stock
In the Woods (Dublin Murder Squad #1),,,0,38.38,2,In stock
In Cold Blood,,,0,49.98,4,In stock
How to Stop Worrying and Start Living,,,0,46.49,5,In stock
Give It Back,,,0,18.32,2,In stock
"Girl, Interrupted",,,0,42.14,3,In stock
Fun Home: A Family Tragicomic,,,0,56.59,4,In stock
"Fruits Basket, Vol. 6 (Fruits Basket #6)",,,0,20.96,4,In stock
Deception Point,,,0,40.32,4,In stock
"Death Note, Vol. 6: Give-and-Take (Death Note #6)",,,0,36.39,3,In stock
Catherine the Great: Portrait of a Woman,,,0,58.55,4,In stock
Better Homes and Gardens New Cook Book,,,0,39.61,3,In stock
An Unquiet Mind: A Memoir of Moods and Madness,,,0,21.3,3,In stock
A Year in Provence (Provence #1),,,0,56.88,4,In stock
World Without End (The Pillars of the Earth #2),,,0,32.97,4,In stock
"Will Grayson, Will Grayson (Will Grayson, Will Grayson)",,,0,47.31,4,In stock
Why Save the Bankers?: And Other Essays on Our Economic and Political Crisis,,,0,48.67,2,In stock
Where She Went (If I Stay #2),,,0,41.73,4,In stock
What If?: Serious Scientific Answers to Absurd Hypothetical Questions,,,0,53.68,4,In stock
Two Summers,,,0,14.64,1,In stock
This Is Your Brain on Music: The Science of a Human Obsession,,,0,38.4,1,In stock
The Secret Garden,,,0,15.08,4,In stock
The Raven King (The Raven Cycle #4),,,0,30.57,2,In stock
The Raven Boys (The Raven Cycle #1),,,0,57.74,4,In stock
The Power Greens Cookbook: 140 Delicious Superfood Recipes,,,0,11.05,5,In stock
The Metamorphosis,,,0,28.58,1,In stock
The Mathews Men: Seven Brothers and the War Against Hitler's U-boats,,,0,42.91,5,In stock
The Little Paris Bookshop,,,0,24.73,3,In stock
The Hiding Place,,,0,55.91,4,In stock
The Grand Design,,,0,13.76,3,In stock
The Firm,,,0,45.56,3,In stock
The Fault in Our Stars,,,0,47.22,1,In stock
The False Prince (The Ascendance Trilogy #1),,,0,56.0,5,In stock
The Expatriates,,,0,44.58,2,In stock
The Dream Thieves (The Raven Cycle #2),,,0,34.5,1,In stock
The Darkest Corners,,,0,11.33,5,In stock
The Crossover,,,0,38.77,4,In stock
The 5th Wave (The 5th Wave #1),,,0,11.83,2,In stock
Tell the Wind and Fire,,,0,45.51,3,In stock
Tell Me Three Things,,,0,41.81,1,In stock
Talking to Girls About Duran Duran: One Young Man's Quest for True Love and a Cooler Haircut,,,0,25.15,4,In stock
Siddhartha,,,0,34.22,5,In stock
Shiver (The Wolves of Mercy Falls #1),,,0,16.23,5,In stock
Remember Me?,,,0,11.48,3,In stock
Red Dragon (Hannibal Lecter #1),,,0,23.37,3,In stock
Peak: Secrets from the New Science of Expertise,,,0,16.28,2,In stock
My Mother Was Nuts,,,0,31.63,4,In stock
Mexican Today: New and Rediscovered Recipes for Contemporary Kitchens,,,0,24.91,5,In stock
Maybe Something Beautiful: How Art Transformed a Neighborhood,,,0,22.54,1,In stock
Lola and the Boy Next Door (Anna and the French Kiss #2),,,0,23.63,4,In stock
Logan Kade (Fallen Crest High #5.5),,,0,13.12,2,In stock
Last One Home (New Beginnings #1),,,0,59.98,3,In stock
Killing Floor (Jack Reacher #1),,,0,31.49,4,In stock
Kill the Boy Band,,,0,15.52,5,In stock
Isla and the Happily Ever After (Anna and the French Kiss #3),,,0,48.13,5,In stock
If I Stay (If I Stay #1),,,0,38.13,5,In stock
I Know Why the Caged Bird Sings (Maya Angelou's Autobiography #1),,,0,36.55,2,In stock
Harry Potter and the Deathly Hallows (Harry Potter #7),,,0,23.32,1,In stock
"Fruits Basket, Vol. 5 (Fruits Basket #5)",,,0,16.33,1,In stock
Foundation (Foundation (Publication Order) #1),,,0,32.42,1,In stock
Fool Me Once,,,0,16.96,1,In stock
Find Her (Detective D.D. Warren #8),,,0,22.37,1,In stock
Evicted: Poverty and Profit in the American City,,,0,42.27,1,In stock
Drama,,,0,38.7,2,In stock
Dracula the Un-Dead,,,0,35.63,5,In stock
Digital Fortress,,,0,58.0,5,In stock
"Death Note, Vol. 5: Whiteout (Death Note #5)",,,0,52.41,1,In stock
"Data, A Love Story: How I Gamed Online Dating to Meet My Match",,,0,32.35,3,In stock
Critique of Pure Reason,,,0,20.75,1,In stock
Booked,,,0,17.49,5,In stock
"Blue Lily, Lily Blue (The Raven Cycle #3)",,,0,34.13,5,In stock
Approval Junkie: Adventures in Caring Too Much,,,0,58.81,5,In stock
An Abundance of Katherines,,,0,10.0,5,In stock
America's War for the Greater Middle East: A Military History,,,0,51.22,2,In stock
Alight (The Generations Trilogy #2),,,0,58.59,4,In stock
A Girl's Guide to Moving On (New Beginnings #2),,,0,31.3,1,In stock
A Game of Thrones (A Song of Ice and Fire #1),,,0,46.42,2,In stock
A Feast for Crows (A Song of Ice and Fire #4),,,0,17.21,4,In stock
A Clash of Kings (A Song of Ice and Fire #2),,,0,10.79,3,In stock
Vogue Colors A to Z: A Fashion Coloring Book,,,0,52.35,4,In stock
The Shining (The Shining #1),,,0,27.88,3,In stock
The Pilgrim's Progress,,,0,50.26,2,In stock
The Perfect Play (Play by Play #1),,,0,59.99,3,In stock
The Passion of Dolssa,,,0,28.32,5,In stock
The Jazz of Physics: The Secret Link Between Music and the Structure of the Universe,,,0,38.71,3,In stock
The Hunger Games (The Hunger Games #1),,,0,29.85,5,In stock
The Hound of the Baskervilles (Sherlock Holmes #5),,,0,14.82,2,In stock
The Gunning of America: Business and the Making of American Gun Culture,,,0,16.81,4,In stock
The Geography of Bliss: One Grump's Search for the Happiest Places in the World,,,0,28.23,2,In stock
The Demonists (Demonist #1),,,0,52.11,2,In stock
"The Demon Prince of Momochi House, Vol. 4 (The Demon Prince of Momochi House #4)",,,0,27.88,2,In stock
The Bone Hunters (Lexy Vaughan & Steven Macaulay #2),,,0,59.71,3,In stock
The Beast (Black Dagger Brotherhood #14),,,0,46.08,5,In stock
Some Women,,,0,13.73,5,In stock
Shopaholic Ties the Knot (Shopaholic #3),,,0,48.39,5,In stock
Paper and Fire (The Great Library #2),,,0,49.45,5,In stock
Outlander (Outlander #1),,,0,19.67,5,In stock
"Orchestra of Exiles: The Story of Bronislaw Huberman, the Israel Philharmonic, and the One Thousand Jews He Saved from Nazi Horrors",,,0,12.36,3,In stock
No One Here Gets Out Alive,,,0,20.02,5,In stock
Night Shift (Night Shift #1-20),,,0,12.75,4,In stock
Needful Things,,,0,47.51,4,In stock
Mockingjay (The Hunger Games #3),,,0,20.44,4,In stock
Misery,,,0,34.79,2,In stock
Little Women (Little Women #1),,,0,28.07,4,In stock
It,,,0,25.01,3,In stock
Harry Potter and the Sorcerer's Stone (Harry Potter #1),,,0,13.9,3,In stock
Harry Potter and the Prisoner of Azkaban (Harry Potter #3),,,0,24.17,4,In stock
Harry Potter and the Order of the Phoenix (Harry Potter #5),,,0,31.63,4,In stock
Harry Potter and the Half-Blood Prince (Harry Potter #6),,,0,48.75,5,In stock
Harry Potter and the Chamber of Secrets (Harry Potter #2),,,0,14.74,1,In stock
Gone with the Wind,,,0,32.49,3,In stock
God Is Not Great: How Religion Poisons Everything,,,0,27.8,1,In stock
Girl With a Pearl Earring,,,0,26.77,1,In stock
"Fruits Basket, Vol. 4 (Fruits Basket #4)",,,0,50.44,4,In stock
Far From True (Promise Falls Trilogy #2),,,0,34.93,2,In stock
Dark Lover (Black Dagger Brotherhood #1),,,0,12.87,1,In stock
Confessions of a Shopaholic (Shopaholic #1),,,0,48.94,2,In stock
Changing the Game (Play by Play #2),,,0,13.38,3,In stock
Candide,,,0,58.63,3,In stock
Can You Keep a Secret?,,,0,21.94,1,In stock
Atlas Shrugged,,,0,26.58,5,In stock
Animal Farm,,,0,57.22,3,In stock
A Walk to Remember,,,0,56.43,1,In stock
A New Earth: Awakening to Your Life's Purpose,,,0,55.65,5,In stock
"A History of God: The 4,000-Year Quest of Judaism, Christianity, and Islam",,,0,27.62,1,In stock
'Salem's Lot,,,0,49.56,4,In stock
Zero History (Blue Ant #3),,,0,34.77,1,In stock
Wuthering Heights,,,0,17.73,3,In stock
World War Z: An Oral History of the Zombie War,,,0,21.8,1,In stock
Wild: From Lost to Found on the Pacific Crest Trail,,,0,46.02,3,In stock
"Where'd You Go, Bernadette",,,0,18.13,1,In stock
When You Are Engulfed in Flames,,,0,30.89,5,In stock
We the People: The Modern-Day Figures Who Have Reshaped and Affirmed the Founding Fathers' Vision of America,,,0,31.95,3,In stock
We Are All Completely Beside Ourselves,,,0,24.04,1,In stock
Walk the Edge (Thunder Road #2),,,0,32.36,3,In stock
Voyager (Outlander #3),,,0,21.07,5,In stock
Very Good Lives: The Fringe Benefits of Failure and the Importance of Imagination,,,0,50.66,3,In stock
Vegan Vegetarian Omnivore: Dinner for Everyone at the Table,,,0,13.66,2,In stock
"Unstuffed: Decluttering Your Home, Mind, and Soul",,,0,58.09,1,In stock
Under the Banner of Heaven: A Story of Violent Faith,,,0,30.0,1,In stock
Two Boys Kissing,,,0,32.74,2,In stock
Twilight (Twilight #1),,,0,41.93,2,In stock
Twenties Girl,,,0,42.8,2,In stock
"Trespassing Across America: One Man's Epic, Never-Done-Before (and Sort of Illegal) Hike Across the Heartland",,,0,53.51,1,In stock
Three-Martini Lunch,,,0,23.21,3,In stock
"Thinking, Fast and Slow",,,0,21.14,1,In stock
The Wild Robot,,,0,56.07,3,In stock
"The Wicked + The Divine, Vol. 3: Commercial Suicide (The Wicked + The Divine)",,,0,14.41,3,In stock
The Undomestic Goddess,,,0,45.75,4,In stock
The Travelers,,,0,15.77,1,In stock
The Tipping Point: How Little Things Can Make a Big Difference,,,0,10.02,2,In stock
The Thing About Jellyfish,,,0,48.77,1,In stock
The Stand,,,0,57.86,2,In stock
The Smitten Kitchen Cookbook,,,0,23.59,1,In stock
The Silkworm (Cormoran Strike #2),,,0,23.05,5,In stock
"The Sandman, Vol. 3: Dream Country (The Sandman (volumes) #3)",,,0,55.55,5,In stock
The Rose & the Dagger (The Wrath and the Dawn #2),,,0,58.64,4,In stock
The Road to Little Dribbling: Adventures of an American in Britain (Notes From a Small Island #2),,,0,23.21,1,In stock
The Rise of Theodore Roosevelt (Theodore Roosevelt #1),,,0,42.57,3,In stock
The Restaurant at the End of the Universe (Hitchhiker's Guide to the Galaxy #2),,,0,10.92,1,In stock
The Rest Is Noise: Listening to the Twentieth Century,,,0,34.77,1,In stock
The Red Tent,,,0,35.66,5,In stock
The Purpose Driven Life: What on Earth Am I Here for?,,,0,37.19,3,In stock
The Purest Hook (Second Circle Tattoos #3),,,0,12.25,1,In stock
The Picture of Dorian Gray,,,0,29.7,2,In stock
The Paris Wife,,,0,36.8,3,In stock
The Obsession,,,0,45.43,1,In stock
The Nightingale,,,0,26.26,4,In stock
The New Guy (and Other Senior Year Distractions),,,0,44.92,3,In stock
The Nanny Diaries (Nanny #1),,,0,52.53,5,In stock
The Name of God is Mercy,,,0,37.25,2,In stock
The Maze Runner (The Maze Runner #1),,,0,20.93,1,In stock
The Lover's Dictionary,,,0,58.09,2,In stock
The Lonely Ones,,,0,43.59,5,In stock
The Lean Startup: How Today's Entrepreneurs Use Continuous Innovation to Create Radically Successful Businesses,,,0,33.92,3,In stock
The Last Painting of Sara de Vos,,,0,55.55,2,In stock
"The Land of 10,000 Madonnas",,,0,29.64,4,In stock
The Infinities,,,0,27.41,1,In stock
The Husband's Secret,,,0,52.51,5,In stock
The Hitchhiker's Guide to the Galaxy (Hitchhiker's Guide to the Galaxy #1),,,0,47.8,3,In stock
The Guns of August,,,0,14.54,2,In stock
The Guernsey Literary and Potato Peel Pie Society,,,0,49.53,1,In stock
The Goldfinch,,,0,43.58,3,In stock
The Giver (The Giver Quartet #1),,,0,12.3,1,In stock
The Girl with All the Gifts,,,0,49.47,3,In stock
The Girl Who Played with Fire (Millennium Trilogy #2),,,0,22.14,2,In stock
The Girl Who Kicked the Hornet's Nest (Millennium Trilogy #3),,,0,57.48,1,In stock
The Exiled,,,0,43.45,3,In stock
"The End of Faith: Religion, Terror, and the Future of Reason",,,0,22.13,4,In stock
"The Elegant Universe: Superstrings, Hidden Dimensions, and the Quest for the Ultimate Theory",,,0,13.03,4,In stock
"The Disappearing Spoon: And Other True Tales of Madness, Love, and the History of the World from the Periodic Table of the Elements",,,0,57.35,5,In stock
The Devil Wears Prada (The Devil Wears Prada #1),,,0,44.29,1,In stock
The Demon-Haunted World: Science as a Candle in the Dark,,,0,52.25,4,In stock
The Day the Crayons Came Home (Crayons),,,0,26.33,5,In stock
The Da Vinci Code (Robert Langdon #2),,,0,22.96,2,In stock
The Cuckoo's Calling (Cormoran Strike #1),,,0,19.21,1,In stock
The Complete Stories and Poems (The Works of Edgar Allan Poe [Cameo Edition]),,,0,26.78,4,In stock
The Complete Poems,,,0,41.32,5,In stock
The Catcher in the Rye,,,0,24.55,1,In stock
The Cat in the Hat (Beginner Books B-1),,,0,16.26,2,In stock
The Case for Christ (Cases for Christianity),,,0,47.84,1,In stock
The Book Thief,,,0,53.49,2,In stock
The Book of Basketball: The NBA According to The Sports Guy,,,0,44.84,5,In stock
The Blind Side: Evolution of a Game,,,0,53.71,5,In stock
The Autobiography of Malcolm X,,,0,23.43,2,In stock
"The Art of Simple Food: Notes, Lessons, and Recipes from a Delicious Revolution",,,0,34.32,3,In stock
The Art of Fielding,,,0,22.1,1,In stock
"Surely You're Joking, Mr. Feynman!: Adventures of a Curious Character",,,0,25.83,2,In stock
Stiff: The Curious Lives of Human Cadavers,,,0,36.74,3,In stock
Spilled Milk: Based on a True Story,,,0,49.51,1,In stock
Something Borrowed (Darcy & Rachel #1),,,0,48.96,5,In stock
Something Blue (Darcy & Rachel #2),,,0,54.62,1,In stock
Soldier (Talon #3),,,0,24.72,2,In stock
Shopaholic & Baby (Shopaholic #5),,,0,46.45,2,In stock
Seven Days in the Art World,,,0,52.33,2,In stock
Seven Brief Lessons on Physics,,,0,30.6,4,In stock
Scarlet (The Lunar Chronicles #2),,,0,14.57,4,In stock
Sarah's Key,,,0,46.29,1,In stock
"Saga, Volume 3 (Saga (Collected Editions) #3)",,,0,21.57,5,In stock
Running with Scissors,,,0,12.91,4,In stock
Rogue Lawyer (Rogue Lawyer #1),,,0,50.11,3,In stock
"Rise of the Rocket Girls: The Women Who Propelled Us, from Missiles to the Moon to Mars",,,0,41.67,4,In stock
Rework,,,0,44.88,2,In stock
Reservations for Two,,,0,11.1,3,In stock
Red: The True Story of Red Riding Hood,,,0,28.54,3,In stock
Ready Player One,,,0,19.07,4,In stock
Quiet: The Power of Introverts in a World That Can't Stop Talking,,,0,43.55,1,In stock
Prodigy: The Graphic Novel (Legend: The Graphic Novel #2),,,0,43.63,3,In stock
Persepolis: The Story of a Childhood (Persepolis #1-2),,,0,39.13,1,In stock
Packing for Mars: The Curious Science of Life in the Void,,,0,56.68,2,In stock
Outliers: The Story of Success,,,0,14.16,1,In stock
Original Fake,,,0,31.45,3,In stock
Orange Is the New Black,,,0,24.61,2,In stock
One for the Money (Stephanie Plum #1),,,0,32.87,2,In stock
Notes from a Small Island (Notes From a Small Island #1),,,0,40.17,1,In stock
Night (The Night Trilogy #1),,,0,13.51,1,In stock
Neither Here nor There: Travels in Europe,,,0,38.95,3,In stock
Naked,,,0,31.69,3,In stock
Morning Star (Red Rising #3),,,0,29.4,1,In stock
"Miracles from Heaven: A Little Girl, Her Journey to Heaven, and Her Amazing Story of Healing",,,0,57.83,1,In stock
Midnight Riot (Peter Grant/ Rivers of London - books #1),,,0,55.46,2,In stock
Me Talk Pretty One Day,,,0,57.6,2,In stock
Manuscript Found in Accra,,,0,34.98,2,In stock
Lust & Wonder,,,0,11.87,2,In stock
Lila (Gilead #3),,,0,12.47,3,In stock
"Life, the Universe and Everything (Hitchhiker's Guide to the Galaxy #3)",,,0,33.26,2,In stock
Life Without a Recipe,,,0,59.04,5,In stock
Life After Life,,,0,26.13,2,In stock
Letter to a Christian Nation,,,0,22.2,1,In stock
Let's Pretend This Never Happened: A Mostly True Memoir,,,0,45.11,1,In stock
Legend (Legend #1),,,0,43.69,4,In stock
"Lean In: Women, Work, and the Will to Lead",,,0,25.02,1,In stock
"Lamb: The Gospel According to Biff, Christ's Childhood Pal",,,0,55.5,5,In stock
Lady Renegades (Rebel Belle #3),,,0,53.04,5,In stock
Jurassic Park (Jurassic Park #1),,,0,44.97,1,In stock
It's Never Too Late to Begin Again: Discovering Creativity and Meaning at Midlife and Beyond,,,0,42.38,1,In stock
Is Everyone Hanging Out Without Me? (And Other Concerns),,,0,20.11,3,In stock
Into the Wild,,,0,56.7,5,In stock
Inferno (Robert Langdon #4),,,0,41.0,5,In stock
